{
  "policy_id": "A7-POL-PROVIDER-GDRIVE-001",
  "version": "1.0.0",
  "status": "ACTIVE",
  "provider": "google_drive",
  "authority_scope": [
    "Drive object identity/state",
    "original file/folder content/revision",
    "provider metadata where exposed"
  ],
  "default_claim_role": "EVIDENCE",
  "underlying_fact_rule": "Drive owns the stored source object; semantic/domain authority still follows the fact-class contract.",
  "public_projection_default": "REVIEW_BEFORE_PUBLICATION",
  "mutation_rule": "Provider mutation requires provider-specific read-before/write/readback evidence when A7 actually changes that provider.",
  "failure_rule": "After three reasonable failures, record/defer this provider dependency and continue independent work without fabricating blocked facts."
}
