{
  "policy_id": "A7-POL-PROVIDER-WHATSAPP-001",
  "version": "1.0.0",
  "status": "ACTIVE",
  "provider": "whatsapp",
  "authority_scope": [
    "verifiably sourced chat/message/export content and provider identity"
  ],
  "default_claim_role": "EVIDENCE",
  "underlying_fact_rule": "WhatsApp proves only a sourced communication record. If connector/export access is unavailable, fail-forward after three attempts and do not infer content.",
  "public_projection_default": "RESTRICTED_UNLESS_EXPLICITLY_PUBLIC_SAFE",
  "mutation_rule": "Provider mutation requires provider-specific read-before/write/readback evidence when A7 actually changes that provider.",
  "failure_rule": "After three reasonable failures, record/defer this provider dependency and continue independent work without fabricating blocked facts."
}
