{
  "policy_id": "A7-POL-PROVIDER-GITHUB-001",
  "version": "1.0.0",
  "status": "ACTIVE",
  "provider": "github",
  "authority_scope": [
    "GitHub object identity/state",
    "repository/ref/commit/workflow state",
    "file content at a provider ref"
  ],
  "default_claim_role": "EVIDENCE",
  "underlying_fact_rule": "GitHub state does not automatically make every repository file the authority for unrelated domain facts.",
  "public_projection_default": "PUBLIC_IF_REPOSITORY_PUBLIC",
  "mutation_rule": "Provider mutation requires provider-specific read-before/write/readback evidence when A7 actually changes that provider.",
  "failure_rule": "After three reasonable failures, record/defer this provider dependency and continue independent work without fabricating blocked facts."
}
